{
  "$schema": "../../../schemas/aether-photometry-occlusion-model.schema.json",
  "schemaVersion": "1.0.0",
  "fixtureId": "vx4800-bf-01",
  "designRevision": "1.3.0",
  "authority": "synthetic-pipeline-test",
  "status": "synthetic-test-only",
  "coordinateSystem": "ceiling XY; z-positive-down",
  "bindings": {
    "systemScenePath": "tests/fixtures/photometry/vx4800-system-synthetic.json",
    "systemSceneSha256": "1f33afd45459e18a6e4dc99ca13b881e3688167042cb237f9583da02cc9a40ca"
  },
  "controlState": {
    "geometry": "synthetic-test-only",
    "directTransmissionAssumptions": "synthetic-test-only",
    "coverageComplete": false
  },
  "objects": [
    {
      "objectId": "SYNTHETIC-OPAQUE-PLANE",
      "category": "other",
      "directTransmissionFactor": 0.0,
      "sourceReference": null,
      "sourceSha256": null,
      "triangles": [
        [[-5.0, -5.0, 2.0], [5.0, -5.0, 2.0], [5.0, 5.0, 2.0]],
        [[-5.0, -5.0, 2.0], [5.0, 5.0, 2.0], [-5.0, 5.0, 2.0]]
      ]
    }
  ],
  "acceptanceCriteria": {
    "status": "not-released",
    "sensorLimits": []
  }
}
